{
  "candles": [
    [
      1735689600,
      100,
      105,
      99,
      104,
      1200
    ],
    [
      1735693200,
      104,
      106,
      101,
      102,
      900
    ],
    [
      1735696800,
      102,
      108,
      101,
      107,
      1500
    ],
    [
      1735700400,
      107,
      109,
      104,
      105,
      1100
    ],
    [
      1735704000,
      105,
      107,
      100,
      101,
      1700
    ],
    [
      1735707600,
      101,
      103,
      98,
      102,
      1300
    ]
  ],
  "indicators": [
    "sma",
    "ema",
    "rsi",
    "atr"
  ],
  "settings": {
    "sma": 3,
    "ema": 3,
    "rsi": 3,
    "atr": 3
  },
  "tail": 3
}